{"applied_review_receipts": [{"path": "CODE/work/WP-MATRIX/R01/review-cold_start.json", "receipt_id": "RR-MATRIX-COLD_START", "role": "cold_start", "sha256": "92a3095682cd4a9eb975f2342c7382e0cc44254fff1bd32e455acf7df45a8ff8", "verdict": "PASS"}, {"path": "CODE/work/WP-MATRIX/R01/review-satellite_drl.json", "receipt_id": "RR-MATRIX-SATELLITE_DRL", "role": "satellite_drl", "sha256": "442e3bc5bbbe9c3fcc3dabd217f3d8e40cd1c78271670484fc1eece1a4d182d1", "verdict": "PASS"}, {"path": "CODE/work/WP-MATRIX/R01/review-adversarial.json", "receipt_id": "RR-MATRIX-ADVERSARIAL", "role": "adversarial", "sha256": "7a365364db4cc7ec9569093349d321918b1db2007824ae6a0022b35e18fc03e9", "verdict": "PASS"}], "artifact_hashes": {"EXPERIMENTS/EXP-LEO-V2-PRE-TRUST-REPRO/RUNBOOK.md": "963b0d48c9cab752dd02347b044e013222ba5c2caaa91da8f52ebc2d51467e4d", "EXPERIMENTS/EXP-LEO-V2-PRE-TRUST-REPRO/analysis-request.json": "dfe8a152b31fa405d2239ef683c0cc01d70ddc9091d75a53ba555021794c5746", "EXPERIMENTS/EXP-LEO-V2-PRE-TRUST-REPRO/compile-report.json": "28692c7008a641219144fb618e44959918439e64b896de3c2a5fa07e0d2b466c", "EXPERIMENTS/EXP-LEO-V2-PRE-TRUST-REPRO/request.json": "86452416bd4e6987b25e9d8d79e2e1ba6e1468b024d431e8b1dfe2bd736fde13", "EXPERIMENTS/EXP-LEO-V2-PRE-TRUST-REPRO/resolved/EXP-LEO-V2-PRE-TRUST-REPRO-control-s7.leo-sim.yaml": "e8ba74c8c0fabfb70be58c786ed74d2fcd20bcf23ab13d9c474fdb7ab13cba00", "EXPERIMENTS/EXP-LEO-V2-PRE-TRUST-REPRO/resolved/EXP-LEO-V2-PRE-TRUST-REPRO-treatment-s7.leo-sim.yaml": "8e470a03594ad4a8eeb827ccdebc6b4bd9a7ab25198c882281a9e9300431d656", "EXPERIMENTS/EXP-LEO-V2-PRE-TRUST-REPRO/run-manifest.json": "bbbc502b166590dbfe42583b0cd6f11168b5dabaadbf5baaea9b399e0c610a5f"}, "blocking_findings": [], "decision": "ACCEPT", "decision_maker_id": "decision:test", "next_revision": null, "producer_id": "producer:test", "rationale": "Fixture reviews bind the complete matrix.", "revision": 1, "revision_instructions": [], "schema": "agent-work-decision/v1", "work_id": "WP-MATRIX"}
