{
  "applied_review_receipts": [
    {
      "path": "CODE/work/WP-LEO-V2-T1-STEP5-GATE-EVIDENCE/R01/review-cold-start.json",
      "receipt_id": "RR-T1-STEP5-R01-COLD",
      "role": "cold_start",
      "sha256": "444e4f12273bf6cb0c31958332390b1ad0ae0e1c6780522ad036f538caa3ca02",
      "verdict": "BLOCK"
    }
  ],
  "artifact_hashes": {
    "EXPERIMENTS/EXP-20260923-T1-STEP5-MICRO-R01/RUNBOOK.md": "fb771e7eba44a237901a783e0f2d964e81d5e36b4e578653b2435690177d704f",
    "EXPERIMENTS/EXP-20260923-T1-STEP5-MICRO-R01/analysis-request.json": "5167eca2e7ee9a7e7fd56a0d79d14c11ceabb75c15d93cc77f5c32afa2449302",
    "EXPERIMENTS/EXP-20260923-T1-STEP5-MICRO-R01/compile-report.json": "adb69d466481820b7adcacd8fa52760e355ac0f744ea8dfe31a3537152cfa69b",
    "EXPERIMENTS/EXP-20260923-T1-STEP5-MICRO-R01/request.json": "af40d995f5e608d685e7a2c33b9424077218282cb6e8cbf047624fc9f04cf5cf",
    "EXPERIMENTS/EXP-20260923-T1-STEP5-MICRO-R01/resolved/EXP-20260923-T1-STEP5-MICRO-R01-cd05-s7.leo-sim.yaml": "c6695b508f1101b7982ce10aa04a308d2af2bdd2a52998ec76515cfe3dc82f6c",
    "EXPERIMENTS/EXP-20260923-T1-STEP5-MICRO-R01/resolved/EXP-20260923-T1-STEP5-MICRO-R01-control-s7.leo-sim.yaml": "864703bd748845818715f6fddb0ed8993d55cde5dac8d4e3177816ae97c02e05",
    "EXPERIMENTS/EXP-20260923-T1-STEP5-MICRO-R01/run-manifest.json": "1ff1a263d543e78aef8bab725e7ed8257e4e394ef450f78c08a416a8025ca891",
    "EXPERIMENTS/EXP-20260923-T1-STEP5-PRESSURE-R01/RUNBOOK.md": "a1ec4854ff9cecdec20c27ad1bc6050aaf4ab8668d95236d36e5ceab5cd172e2",
    "EXPERIMENTS/EXP-20260923-T1-STEP5-PRESSURE-R01/analysis-request.json": "7debbb3a0de14676d21bc346156f40f19b250e09380ee576db275b65c807e494",
    "EXPERIMENTS/EXP-20260923-T1-STEP5-PRESSURE-R01/compile-report.json": "6c30d635b3e00e576e20bb63b23b35c26a15420684ade5acc56f29aae787531c",
    "EXPERIMENTS/EXP-20260923-T1-STEP5-PRESSURE-R01/request.json": "47fa78d35972a91c987d553bd4eab6ae9cfa4c8b76b2c2eae85ec55c6d310d12",
    "EXPERIMENTS/EXP-20260923-T1-STEP5-PRESSURE-R01/resolved/EXP-20260923-T1-STEP5-PRESSURE-R01-cd05-s7.leo-sim.yaml": "108e67a93927216e752c3e2b07c3e364374bef763387086e4a6ef95cda4b14ef",
    "EXPERIMENTS/EXP-20260923-T1-STEP5-PRESSURE-R01/resolved/EXP-20260923-T1-STEP5-PRESSURE-R01-control-s7.leo-sim.yaml": "fc4d69549fe066473b9c64ca2861793800df2a4d3e4cf65a2f4bf7fe91b9c7b0",
    "EXPERIMENTS/EXP-20260923-T1-STEP5-PRESSURE-R01/run-manifest.json": "92358d142d58f9a67cda588a372d5c915301b70b5fb3d0f97e74f74a0bba195d"
  },
  "blocking_findings": [
    "COLD-B1: primary_metric independent_recompute_closure is rejected by the RUNBOOK-mandated v2_analysis step",
    "COLD-B2: the load-bearing recomputation workflow was not reproducible from the artifacts and was outside the reviewed hash set",
    "COLD-B3: truncated report lists and an undeclared gap tolerance contradicted the exhaustive-reporting requirement"
  ],
  "decision": "REVISE",
  "decision_maker_id": "decision:step5-batch-producer-gate",
  "next_revision": 2,
  "producer_id": "producer:step5-batch-deepseek",
  "rationale": "The cold_start review returned BLOCK with three findings, each re-verified by the producer before acting: (B1) the generated RUNBOOK mandates a v2_analysis step that unconditionally rejects the declared primary_metric independent_recompute_closure (reproduced in-process: v2_analysis._metric_from_result raises 'unsupported V2 primary metric'); (B2) the recomputation harness had no entry point, no production comparator, no witness verifier and was outside the reviewed hash set; (B3) the harness truncated its mismatch lists and left its tolerance undeclared. All three are real defects in the revision-1 package, so the batch must not proceed to deployment on revision 1.",
  "revision": 1,
  "revision_instructions": [
    "Declare a primary_metric that v2_analysis supports, and state explicitly that the independent recomputation remains the acceptance basis for both evidence chains",
    "Turn the harness into a CLI with an explicit production-reading comparator, a decision-log witness verifier and a declared tolerance contract, and bind it (plus the procedure document and the demand CSV) into decision.artifact_hashes so every review receipt must hash-bind it",
    "Remove all truncation from the report and emit full per-gap tables plus a declared tolerance contract",
    "Give revision 2 its own experiment_id so the revision-1 compiled artifacts are preserved rather than replaced"
  ],
  "schema": "agent-work-decision/v1",
  "work_id": "WP-LEO-V2-T1-STEP5-GATE-EVIDENCE"
}
