{"applied_review_receipts": [{"path": "CODE/work/WP-LEO-V2-PRE-TRUST-REPRO/R01/review-cold_start.json", "receipt_id": "RR-PRE-TRUST-COLD_START", "role": "cold_start", "sha256": "7a874eccdd118ee8c0136fd5e060049606816dada87084f80f5ece9fef3fc52e", "verdict": "PASS"}, {"path": "CODE/work/WP-LEO-V2-PRE-TRUST-REPRO/R01/review-satellite_drl.json", "receipt_id": "RR-PRE-TRUST-SATELLITE_DRL", "role": "satellite_drl", "sha256": "e6b6d77f45636fb94f333d8f45d0ec553ae00f5d07d736b784bd0b4e390ac56c", "verdict": "PASS"}, {"path": "CODE/work/WP-LEO-V2-PRE-TRUST-REPRO/R01/review-adversarial.json", "receipt_id": "RR-PRE-TRUST-ADVERSARIAL", "role": "adversarial", "sha256": "bd128357cae4996b1d1eb468da073bc3f32992c4058d37c54fe9b5f9ef52d563", "verdict": "PASS"}], "artifact_hashes": {"EXPERIMENTS/EXP-LEO-V2-PRE-TRUST-REPRO/RUNBOOK.md": "963b0d48c9cab752dd02347b044e013222ba5c2caaa91da8f52ebc2d51467e4d", "EXPERIMENTS/EXP-LEO-V2-PRE-TRUST-REPRO/analysis-request.json": "9e510710405b19e7efb8cdbc75663620feebe83b2f854af82df628a5ac61f18b", "EXPERIMENTS/EXP-LEO-V2-PRE-TRUST-REPRO/compile-report.json": "1cb490a2924424710a036896f4612f9d17e1b624aee4d19980d46d211c14d799", "EXPERIMENTS/EXP-LEO-V2-PRE-TRUST-REPRO/request.json": "1616a8d864c420e910f15933b1a42da4ecbf06497ceeef7ac4a961d188ecee7f", "EXPERIMENTS/EXP-LEO-V2-PRE-TRUST-REPRO/resolved/EXP-LEO-V2-PRE-TRUST-REPRO-control-s7.leo-sim.yaml": "e8ba74c8c0fabfb70be58c786ed74d2fcd20bcf23ab13d9c474fdb7ab13cba00", "EXPERIMENTS/EXP-LEO-V2-PRE-TRUST-REPRO/resolved/EXP-LEO-V2-PRE-TRUST-REPRO-treatment-s7.leo-sim.yaml": "8e470a03594ad4a8eeb827ccdebc6b4bd9a7ab25198c882281a9e9300431d656", "EXPERIMENTS/EXP-LEO-V2-PRE-TRUST-REPRO/run-manifest.json": "cce6a75dec7f48b8f865bef2bab362caeaaa58990286c986d9a7058bdd842775"}, "blocking_findings": [], "decision": "ACCEPT", "decision_maker_id": "decision:pre-experiment-trust", "next_revision": null, "producer_id": "producer:pre-experiment-trust", "rationale": "Fixture reviews bind the complete matrix.", "revision": 1, "revision_instructions": [], "schema": "agent-work-decision/v1", "work_id": "WP-LEO-V2-PRE-TRUST-REPRO"}
