{
  "applied_review_receipts": [
    {
      "path": "CODE/work/WP-LEO-V2-T1-STEP5-GATE-EVIDENCE/R03/review-cold-start.json",
      "receipt_id": "RR-T1-STEP5-R03-COLD",
      "role": "cold_start",
      "sha256": "f051220d18b860348d6d214faf8acf48177ffa126bb7066bb759c468e4e7efff",
      "verdict": "PASS"
    },
    {
      "path": "CODE/work/WP-LEO-V2-T1-STEP5-GATE-EVIDENCE/R03/review-satellite-drl.json",
      "receipt_id": "RR-T1-STEP5-R03-SATDRL",
      "role": "satellite_drl",
      "sha256": "b95be31f2a58aff49752b62cab956472037f5855616321db2edefbc37c758756",
      "verdict": "PASS"
    },
    {
      "path": "CODE/work/WP-LEO-V2-T1-STEP5-GATE-EVIDENCE/R03/review-adversarial.json",
      "receipt_id": "RR-T1-STEP5-R03-ADV",
      "role": "adversarial",
      "sha256": "28798364a29579552fa257635a899aa72b0a22c050bc0d6ff472136da4236fff",
      "verdict": "PASS"
    }
  ],
  "artifact_hashes": {
    "CODE/data/traffic/t1_step5_micro_ab.csv": "26536d8b3b894a13d74289131653fddfdae8fe095f7c4edb2dc6a1683ec37592",
    "CODE/work/WP-LEO-V2-T1-STEP5-GATE-EVIDENCE/R03/PROCEDURE.md": "8618bb0d84b356da2ac24e1d533f4030f44c704bcca3182d4658cc6b7cb34111",
    "CODE/work/WP-LEO-V2-T1-STEP5-GATE-EVIDENCE/tools/step5_recompute.py": "756b95478e86d6f2449863cdc2f0bd6578f9aa5059d571ae5a81471ded53fa73",
    "EXPERIMENTS/EXP-20260923-T1-STEP5-MICRO-R03/RUNBOOK.md": "7c2ee7f094dce76690c7696e54fc57d70fdb5ec1bab6586d7ca3d14d09f29762",
    "EXPERIMENTS/EXP-20260923-T1-STEP5-MICRO-R03/analysis-request.json": "056c9562064fa1afd834b0a14a86461e3dea68f647a15b576a273caff4fdd846",
    "EXPERIMENTS/EXP-20260923-T1-STEP5-MICRO-R03/compile-report.json": "9715856ad5734306d69d0869c6c8547c34998cc9652f5803f41062a845d71d5d",
    "EXPERIMENTS/EXP-20260923-T1-STEP5-MICRO-R03/request.json": "8fd5cada438230453f6cb38eadd3cf84ede9015ab31050010640cfffd24c1bd3",
    "EXPERIMENTS/EXP-20260923-T1-STEP5-MICRO-R03/resolved/EXP-20260923-T1-STEP5-MICRO-R03-cd05-s7.leo-sim.yaml": "c6695b508f1101b7982ce10aa04a308d2af2bdd2a52998ec76515cfe3dc82f6c",
    "EXPERIMENTS/EXP-20260923-T1-STEP5-MICRO-R03/resolved/EXP-20260923-T1-STEP5-MICRO-R03-control-s7.leo-sim.yaml": "864703bd748845818715f6fddb0ed8993d55cde5dac8d4e3177816ae97c02e05",
    "EXPERIMENTS/EXP-20260923-T1-STEP5-MICRO-R03/run-manifest.json": "4d986eb57cae9cd62e347b493827bd64853cb6cebb6aee5c75c747f56e2d294e",
    "EXPERIMENTS/EXP-20260923-T1-STEP5-PRESSURE-R03/RUNBOOK.md": "52ea9eaa34087bf4277dd535f0dd878cfd90079efbb26f59c14be55fa2327485",
    "EXPERIMENTS/EXP-20260923-T1-STEP5-PRESSURE-R03/analysis-request.json": "a7c80b49ad3dabb3a984b80ab3f695fbcfe1b756a730b717966e95134d3b1f3f",
    "EXPERIMENTS/EXP-20260923-T1-STEP5-PRESSURE-R03/compile-report.json": "609621adbd4a83e042686af4b5c3ba50dafec51d09d5b32d238748bfd0cb286d",
    "EXPERIMENTS/EXP-20260923-T1-STEP5-PRESSURE-R03/request.json": "77cfbde9905e177f62f158c539b0160e4cec7d1d7920d2da3267c105571b2186",
    "EXPERIMENTS/EXP-20260923-T1-STEP5-PRESSURE-R03/resolved/EXP-20260923-T1-STEP5-PRESSURE-R03-cd05-s7.leo-sim.yaml": "108e67a93927216e752c3e2b07c3e364374bef763387086e4a6ef95cda4b14ef",
    "EXPERIMENTS/EXP-20260923-T1-STEP5-PRESSURE-R03/resolved/EXP-20260923-T1-STEP5-PRESSURE-R03-control-s7.leo-sim.yaml": "fc4d69549fe066473b9c64ca2861793800df2a4d3e4cf65a2f4bf7fe91b9c7b0",
    "EXPERIMENTS/EXP-20260923-T1-STEP5-PRESSURE-R03/run-manifest.json": "5da415df17eefe1299d10fe6a113e25ca3470ed2d3bfcd62f1e17601fac0bcbd"
  },
  "blocking_findings": [],
  "decision": "ACCEPT",
  "decision_maker_id": "decision:step5-batch-producer-gate",
  "next_revision": null,
  "producer_id": "producer:step5-batch-deepseek",
  "rationale": "ROOT CAUSE ACROSS ALL THREE REVIEW ROUNDS, recorded as required. The defects found in revisions 1 and 2 were not defects of the measurements or of the evidence logic; they were defects of process documentation that had never been mechanically checked against the real toolchain. Round 1: the compiler-generated RUNBOOK mandates a post-run analysis step whose metric whitelist unconditionally rejects the metric the request declared, so the documented flow could not complete (v2_analysis.py:276); the recomputation harness had no entry point and lay outside the reviewed hash set; its reports were truncated. Round 2: the same class again - the procedure named superseded experiment directories, and because run-remote.sh:97 derives the run id from the config filename, following it would have executed the wrong revision and attributed the runs to it, while the procedure documented no finalization or authorization step at all even though run-remote.sh:82 refuses to start without one. In every case a human-readable instruction was treated as if it were executable, and nothing mechanically compared the prose to the tools it invokes. Revision 3 therefore does not just correct individual sentences: it derives every run command from the revision own experiment ids and adds a mechanical check that no run command can reference an earlier revision, and it documents the authorization chain with the exact commands and expected sentinels. The residual risk is recorded rather than hidden: the check is a documented, reproducible one-liner rather than a committed gate inside the pipeline, so the durable fix is to make procedure executability a mechanical gate before any formal run. REVIEWER PROVENANCE, recorded verbatim as required. Revision 1 cold_start review was performed by a Codex cold-start session, a different model family from the executing agent, and returned BLOCK. Revisions 2 and 3 were reviewed by independent cold-start sessions on z-ai/glm-5.3-flash (Zhipu GLM family) for cold_start and adversarial, and meta/muse-spark-1.3-contributor (Meta Muse family) for satellite_drl. AGENTS.md rule 20 requires different-model cold-start review OR Codex independent cold-start self-review; two non-DeepSeek families satisfy the different-model branch. Codex became unavailable because its quota was exhausted, so these rounds substituted GLM/Muse and did NOT wait for the quota to recover. Reviewer independence is evidenced by the reviewers own work rather than by attestation: the satellite_drl reviewer re-hashed all 17 bound artifacts itself, independently recomputed the corridor profile equivalence (load_config_file(profile) == d45c6a50580958c3d14bc7ff576cb36f0f57c91953e12c8c80478842277fd27f) and independently inspected the denominator fallback at CODE/leo_sim/metrics.py:334-340; the cold_start reviewer independently ran the harness selftest and re-verified the paired-design signatures; the adversarial reviewer was a fresh cold-start session on the final bytes. MECHANICAL SELF-CHECK, reproducible. Command: grep -n \"EXPERIMENTS/EXP-20260923-T1-STEP5-[A-Z]*-R0[12]\" R03/PROCEDURE.md . Expected sentinel: no match, grep exits 1, so a shell && / || chain prints the clean sentinel. Actual output: no match, sentinel none (clean). Companion check: the four run commands extracted from PROCEDURE.md are set-equal to the four run_id values in the two R03 run-manifest.json files; both were re-run at decision time and both hold. This check is a documented, reproducible one-liner, NOT a committed pipeline gate, and that limitation is stated rather than glossed. UNFIXED PROCESS DEFECT REGISTERED, deliberately not repaired in this batch: the compiler-generated RUNBOOK mandates v2_analysis while v2_analysis._metric_from_result (CODE/experiment_platform/v2_analysis.py:276) rejects any metric outside its whitelist. This batch works around it by declaring the supported metric e2e_delay_mean_s; editing v2_analysis or widening its whitelist would be a production-contract change outside this batch authorisation, and was not done. All five blocking findings from rounds 1 and 2 are preserved verbatim in R01/decision.json and R02/decision.json rather than folded away.",
  "revision": 3,
  "revision_instructions": [],
  "schema": "agent-work-decision/v1",
  "work_id": "WP-LEO-V2-T1-STEP5-GATE-EVIDENCE"
}
