{
  "schema": "agent-work-decision/v1",
  "work_id": "WP-LEO-V2-PILOT-BASELINES-EVAL",
  "revision": 1,
  "producer_id": "producer:codex",
  "artifact_hashes": {
    "CODE/work/WP-LEO-V2-PILOT-BASELINES-EVAL/R01/brief.json": "da9d09e587651ad62ab4d047a70145d492010f189e12156a8877f2a86f52fa47",
    "EXPERIMENTS/EXP-20260821-PILOT-BASELINES-EVAL-R01/request-source.json": "230d2d19f3bf497efdc85bca443a3b9202566c6067b054660c17a33b812b0df6",
    "EXPERIMENTS/EXP-20260821-PILOT-BASELINES-EVAL-R01/RUNBOOK.md": "8785e0ee061bdb0b74ac7b8639ce20a9af0078bc34dd243321b3120b120f86f3",
    "EXPERIMENTS/EXP-20260821-PILOT-BASELINES-EVAL-R01/analysis-request.json": "aeb5862cf9da941efd2b9130725f59f6e1db2259fe25227be4a3c95730c6633f",
    "EXPERIMENTS/EXP-20260821-PILOT-BASELINES-EVAL-R01/compile-report.json": "39a8b5387327a1f4d217c1103eb1148c33f5d778c5c3b7e9ab42a027f33f483b",
    "EXPERIMENTS/EXP-20260821-PILOT-BASELINES-EVAL-R01/request.json": "230d2d19f3bf497efdc85bca443a3b9202566c6067b054660c17a33b812b0df6",
    "EXPERIMENTS/EXP-20260821-PILOT-BASELINES-EVAL-R01/run-manifest.json": "21f1ebd8f069493cf3d6cd057676e9828e12979144a0724cace6f17634ec0d19",
    "EXPERIMENTS/EXP-20260821-PILOT-BASELINES-EVAL-R01/resolved/EXP-20260821-PILOT-BASELINES-EVAL-R01-ddqn_c3_a_eval-s7-l7.leo-sim.yaml": "b6e7ddb299c04813307442cfd3b1058648945cd35b13bf2eefb95a151afcdac6",
    "EXPERIMENTS/EXP-20260821-PILOT-BASELINES-EVAL-R01/resolved/EXP-20260821-PILOT-BASELINES-EVAL-R01-ddqn_c3_b_eval-s7-l7.leo-sim.yaml": "9bd36c7c896eb3526a5b01926bc9800ed47a7794d8be25854fab045c58daba20",
    "EXPERIMENTS/EXP-20260821-PILOT-BASELINES-EVAL-R01/resolved/EXP-20260821-PILOT-BASELINES-EVAL-R01-gat_a_eval-s7-l7.leo-sim.yaml": "0225484181b5f543217b53be0086e5120452db7cf8ba087d918794bae32ca308",
    "EXPERIMENTS/EXP-20260821-PILOT-BASELINES-EVAL-R01/resolved/EXP-20260821-PILOT-BASELINES-EVAL-R01-gat_b_eval-s7-l7.leo-sim.yaml": "4d8639271c8f52cb6abcbd4bf68e2583cf5825c1b69c05ed84ee5b49968de925",
    "EXPERIMENTS/EXP-20260821-PILOT-BASELINES-EVAL-R01/resolved/EXP-20260821-PILOT-BASELINES-EVAL-R01-mpnn_a_eval-s7-l7.leo-sim.yaml": "9ef19e85b7553d3d215cc327e9cdba4cd7af6c222967bb9e8f0238a0d2c65727",
    "EXPERIMENTS/EXP-20260821-PILOT-BASELINES-EVAL-R01/resolved/EXP-20260821-PILOT-BASELINES-EVAL-R01-mpnn_b_eval-s7-l7.leo-sim.yaml": "2b7741adb3a0bad4d84ab8642d410a03484332293da6234fc929f1c9da1624ff",
    "EXPERIMENTS/EXP-20260821-PILOT-BASELINES-EVAL-R01/resolved/EXP-20260821-PILOT-BASELINES-EVAL-R01-qlearning_a_eval-s7-l7.leo-sim.yaml": "3cf9d3dfcc488384ff3a39c28af2c3dada4b2e65905732dd24b36c432dcb384a",
    "EXPERIMENTS/EXP-20260821-PILOT-BASELINES-EVAL-R01/resolved/EXP-20260821-PILOT-BASELINES-EVAL-R01-qlearning_b_eval-s7-l7.leo-sim.yaml": "32512647ab4dcaaadb30cf4202aa43cf22fa36dc205da8d3a139d8fb31b65947"
  },
  "decision_maker_id": "decision:research-lead-codex",
  "applied_review_receipts": [
    {
      "receipt_id": "RR-PILOT-BASELINES-EVAL-R01-COLD",
      "path": "CODE/work/WP-LEO-V2-PILOT-BASELINES-EVAL/R01/review-cold-start.json",
      "sha256": "34a50ddeabd3c315d58808fecc037484d6ed5b4976a3243d47c20d447ea1baf5",
      "role": "cold_start",
      "verdict": "PASS"
    },
    {
      "receipt_id": "RR-PILOT-BASELINES-EVAL-R01-SAT",
      "path": "CODE/work/WP-LEO-V2-PILOT-BASELINES-EVAL/R01/review-satellite-drl.json",
      "sha256": "38cabf0fc016a58fda98fd20a95f63dccab0be483edf706dcd1fa21d9ae9bf1e",
      "role": "satellite_drl",
      "verdict": "PASS"
    },
    {
      "receipt_id": "RR-PILOT-BASELINES-EVAL-R01-ADV",
      "path": "CODE/work/WP-LEO-V2-PILOT-BASELINES-EVAL/R01/review-adversarial.json",
      "sha256": "436d6eb0c127f684f627d86cd1fef36b2b63a25ddb72b70747ace86fc7400a7e",
      "role": "adversarial",
      "verdict": "PASS"
    }
  ],
  "decision": "ACCEPT",
  "rationale": "三类独立审阅均从同一精确源码 SHA 和同一组 15 项编译产物出发并通过。该接受只授权将八个 evaluation-only 单元部署到同一 SHA 的 VM 执行；它不等同于已运行、训练成功或算法优越性结论。",
  "blocking_findings": [],
  "revision_instructions": [],
  "next_revision": null
}
