{
  "applied_review_receipts": [
    {
      "path": "CODE/work/WP-LEO-V2-T1-STEP5-GATE-EVIDENCE/R05/review-cold-start.json",
      "receipt_id": "RR-T1-STEP5-R05-COLD",
      "role": "cold_start",
      "sha256": "d96da10c75fc7ebf9cc488cfba9cef4b8cb2ed189aa80f53634278cfa8d3d44b",
      "verdict": "BLOCK"
    },
    {
      "path": "CODE/work/WP-LEO-V2-T1-STEP5-GATE-EVIDENCE/R05/review-satellite-drl.json",
      "receipt_id": "RR-T1-STEP5-R05-SATDRL",
      "role": "satellite_drl",
      "sha256": "b3d05f781ca77b0f19d98b29377b1f1fb37f341dcb239681919905bdc15cc5ec",
      "verdict": "PASS"
    }
  ],
  "artifact_hashes": {
    "CODE/data/traffic/t1_step5_micro_ab.csv": "26536d8b3b894a13d74289131653fddfdae8fe095f7c4edb2dc6a1683ec37592",
    "CODE/work/WP-LEO-V2-T1-STEP5-GATE-EVIDENCE/R05/PROCEDURE.md": "50f96cf018c1264d5d55efc4c89173a0c2d05b80c849ad85f828cf82bffc57ed",
    "CODE/work/WP-LEO-V2-T1-STEP5-GATE-EVIDENCE/tools/check_procedure.py": "e905621e4778cb5e8c0e2dc4e90fd066e43027fdb1c838346b2321b7298f5330",
    "CODE/work/WP-LEO-V2-T1-STEP5-GATE-EVIDENCE/tools/step5_recompute.py": "756b95478e86d6f2449863cdc2f0bd6578f9aa5059d571ae5a81471ded53fa73",
    "EXPERIMENTS/EXP-20260923-T1-STEP5-MICRO-R05/RUNBOOK.md": "54a36378446c3c8cb8e3542fcd56c3af82146d93ea695e52ce445e67d1f6def4",
    "EXPERIMENTS/EXP-20260923-T1-STEP5-MICRO-R05/analysis-request.json": "af1e3a1c3dd6cedf3d51294d2b173bfdc178d4336a70bb0741b8dc937e27ca3f",
    "EXPERIMENTS/EXP-20260923-T1-STEP5-MICRO-R05/compile-report.json": "4eac585a3c3ada5a6ca380660c5d782e0cf31f72a01d86b32a5cf148a95a2a40",
    "EXPERIMENTS/EXP-20260923-T1-STEP5-MICRO-R05/request.json": "f319a6e8a893472451a34290ea72ea3f94e97ed672bad709cf25591b04260d12",
    "EXPERIMENTS/EXP-20260923-T1-STEP5-MICRO-R05/resolved/EXP-20260923-T1-STEP5-MICRO-R05-cd05-s7.leo-sim.yaml": "21a15e74af8a8e743ef9475ae53ea837c66d7607bad4ed029c671bd7bb81a8cc",
    "EXPERIMENTS/EXP-20260923-T1-STEP5-MICRO-R05/resolved/EXP-20260923-T1-STEP5-MICRO-R05-control-s7.leo-sim.yaml": "4eb001c5a45665a5c941d5e5af9e58f90471e59f430ea26db1281d20ce8b9924",
    "EXPERIMENTS/EXP-20260923-T1-STEP5-MICRO-R05/run-manifest.json": "eb5352634c9d173af1b5502e288afcc152e7931cd858fcb17b613e4b3d926b4e",
    "EXPERIMENTS/EXP-20260923-T1-STEP5-PRESSURE-R05/RUNBOOK.md": "4f6cd540a1734efffc8e94012659e9001e490917727f47077b6a7dfeddc41239",
    "EXPERIMENTS/EXP-20260923-T1-STEP5-PRESSURE-R05/analysis-request.json": "0f4f61e02452fb714eaeb811ce9f92557136965db215422c6b4e237dee8b2d87",
    "EXPERIMENTS/EXP-20260923-T1-STEP5-PRESSURE-R05/compile-report.json": "143762e37e49d964863656920b55d4f5b720b68751db42dee3264a0c52f7e7cd",
    "EXPERIMENTS/EXP-20260923-T1-STEP5-PRESSURE-R05/request.json": "d635ccbf287a49595d98df8ae0a90012fb59969aaf4f26771078fd4069738fb2",
    "EXPERIMENTS/EXP-20260923-T1-STEP5-PRESSURE-R05/resolved/EXP-20260923-T1-STEP5-PRESSURE-R05-cd05-s7.leo-sim.yaml": "db31faeb008e781c3514c0632f5fa0ccc2dee8eb66b0a605e91a552d294cdbb4",
    "EXPERIMENTS/EXP-20260923-T1-STEP5-PRESSURE-R05/resolved/EXP-20260923-T1-STEP5-PRESSURE-R05-control-s7.leo-sim.yaml": "5c0eb53a77f0345086cc9c410d356bfec965d779a03e15baf0e364e80f0a5486",
    "EXPERIMENTS/EXP-20260923-T1-STEP5-PRESSURE-R05/run-manifest.json": "302efa7338e6a13e4084eb35fad8e83ea627748ac2918811b6793983fdf32cca"
  },
  "blocking_findings": [
    "[cold_start] GATE DEFEATED (new, demonstrated, reproducible): a complete EXECUTABLE run-remote.sh command referencing the earlier revision EXP-20260923-T1-STEP5-MICRO-R03, placed UNFENCED and backslash-continued so that every id occurrence splits across lines, is ACCEPTED by the R05 gate (exit 0, all_checks_ok=true, G1a ok, G1b ok, G4 ok with the artifact set rebound to the mutated procedure bytes). Bash executability proof: the continuations join to 'run-remote.sh --runtime-kind leo_sim_v2 --config EXPERIME",
    "[cold_start] G1a scanner gaps for non-contiguous and case-mutated ids: a stale id split across two prose lines and a lowercase exp-...-r03 id in prose are both ACCEPTED (exit 0) because the regex is case-sensitive and line-contiguous; the executable one-line forms are caught by G1b (verified in the matrix), so these are scanner-level gaps, but they leave the 'no earlier-revision id anywhere in the document' contract unenforced for split/case variants and uncovered by any negative control."
  ],
  "decision": "REVISE",
  "decision_maker_id": "decision:step5-batch-producer-gate",
  "next_revision": 6,
  "producer_id": "producer:step5-batch-deepseek",
  "rationale": "Revision 5 closed all three R04 blockers: the producer reproduced the R04 unfenced-command defeat and confirmed the whole-document scan now catches it; the stale pre-F2 corridor claim is gone; and the F2 disclosure is backed by gate check G5 with the actual per-cell resolved values. The satellite_drl review returned PASS after verifying those fixes independently. The cold_start review nevertheless returned BLOCK, and the producer reproduced BOTH of its findings: an executable backslash-continued unfenced run-remote command whose experiment id is split across lines is accepted, and a stale id split across two prose lines or written in lower case is not detected at all. This is the THIRD consecutive round in which a text-scanning patch of this gate was evaded: R04 evaded the fenced-only scan with an unfenced command; R05 evaded the whole-document scan with line-continuation splitting and case folding. The producer therefore stops patching and escalates a re-plan instead of opening another round, following the repository rule that after three rounds with blocking findings the work stops and is re-planned rather than extended. Root cause and options are in the producer escalation. The R05 adversarial receipt was still pending when this REVISE record was written; it is not required for a REVISE decision, and its findings will be appended to the escalation if it returns.",
  "revision": 5,
  "revision_instructions": [
    "ESCALATED - DO NOT PATCH AGAIN WITHOUT A DECISION. Candidate structural fix: stop scanning human prose and instead GENERATE the four run commands from the run-manifests at gate time, requiring the command blocks in the procedure to byte-equal the generated text; the commands are then derived rather than checked, so fenced, unfenced, split, lower-case or otherwise obfuscated variants cannot differ from the generated form without failing an equality test",
    "Alternative: accept the gate as a hygiene control for realistic accidental drift, document the deliberate-obfuscation boundary explicitly in the procedure and in the decision, and proceed to authorization and the formal runs",
    "Either way: keep the existing per-check negative controls, proven live - a sandboxed gate with one control disabled yields unproven_gates non-empty, all_checks_ok false and exit 1"
  ],
  "schema": "agent-work-decision/v1",
  "work_id": "WP-LEO-V2-T1-STEP5-GATE-EVIDENCE"
}
