{"applied_review_receipts": [{"path": "CODE/work/WP-LEO-V2-ACCEPT-R4/R01/review-cold_start.json", "receipt_id": "RR-ACCEPT-COLD_START", "role": "cold_start", "sha256": "b2721c7ae1e2d3c7fefa8af6a9a7c180add4f89808dd362d2c4c57a20fb5954b", "verdict": "PASS"}, {"path": "CODE/work/WP-LEO-V2-ACCEPT-R4/R01/review-satellite_drl.json", "receipt_id": "RR-ACCEPT-SATELLITE_DRL", "role": "satellite_drl", "sha256": "83131ffe69340cbfe65ab996d603e1dfc92088f6dea7a9fc60f2203db2ed49f4", "verdict": "PASS"}, {"path": "CODE/work/WP-LEO-V2-ACCEPT-R4/R01/review-adversarial.json", "receipt_id": "RR-ACCEPT-ADVERSARIAL", "role": "adversarial", "sha256": "571bb9aa6d69b72995657a8f1c8b959b394762ba2f39fb6f41f18fcfaa5403b8", "verdict": "PASS"}], "artifact_hashes": {"EXPERIMENTS/EXP-LEO-V2-ACCEPT-R4/RUNBOOK.md": "c174a488c1ef86c9bcd197059effecaf1ae6d3353ba76ccb640b176993c9afba", "EXPERIMENTS/EXP-LEO-V2-ACCEPT-R4/analysis-request.json": "d4f4c6c15bdc4fd883d75b6aa1151771aa107a86a43c9f6059dd49f7d3692b15", "EXPERIMENTS/EXP-LEO-V2-ACCEPT-R4/compile-report.json": "51512604648f7b9dfa4e388d1d8e9e53cf0742cf5f6b6bff4db0caecc1c91425", "EXPERIMENTS/EXP-LEO-V2-ACCEPT-R4/request.json": "d3e509aa0b0feb3a009d295a153f7f46318242985e1cac387f49bb916c18ac5e", "EXPERIMENTS/EXP-LEO-V2-ACCEPT-R4/resolved/EXP-LEO-V2-ACCEPT-R4-control-s7.leo-sim.yaml": "e8ba74c8c0fabfb70be58c786ed74d2fcd20bcf23ab13d9c474fdb7ab13cba00", "EXPERIMENTS/EXP-LEO-V2-ACCEPT-R4/resolved/EXP-LEO-V2-ACCEPT-R4-treatment-s7.leo-sim.yaml": "8e470a03594ad4a8eeb827ccdebc6b4bd9a7ab25198c882281a9e9300431d656", "EXPERIMENTS/EXP-LEO-V2-ACCEPT-R4/run-manifest.json": "af7c7e18a082d951d38d1c68cd75fa4fbd8658dea694a073ccc638e872f7db93"}, "blocking_findings": [], "decision": "ACCEPT", "decision_maker_id": "decision:platform-acceptance", "next_revision": null, "producer_id": "producer:platform-acceptance", "rationale": "Acceptance fixture; artifact review is a separate step.", "revision": 1, "revision_instructions": [], "schema": "agent-work-decision/v1", "work_id": "WP-LEO-V2-ACCEPT-R4"}
